{"capabilities":[],"description":"A deliberately small item tracker for the adaptation exercise.","files":{"app.worker.js":{"bytes":682,"sha256":"6V2wAJFY7Bl2BG3a49Q1joPVqr1k6R9K6sg845NALPg"}},"id":"dev.example.tracker","limits":{"maxEventRate":30,"maxViewNodes":2000},"name":"Tiny Tracker","publisher":{"displayName":"TEST ONLY Example Studio","keyId":"sha256:_oEsEvOrTOasXbaaw1L5BssbEe9D-zPiUu9_9VImOIk","publicKey":"6kpsY-KcUgq-9VB7Ey7F-ZVHdq6-vnuSQh7qaRRG0iw"},"runtime":"smallframe-view/1","schemaVersion":"1.0","state":{"jsonSchema":{"additionalProperties":false,"properties":{"items":{"additionalProperties":{"additionalProperties":false,"properties":{"done":{"type":"boolean"},"label":{"maxLength":120,"type":"string"}},"required":["label","done"],"type":"object"},"type":"object"}},"required":["items"],"type":"object"},"maxPlaintextBytes":393216,"mode":"personal","publicTemplate":{"items":{}}},"version":"0.1.0"}
