{"capabilities":[],"description":"A bounded numeric calculator for the adaptation exercise.","files":{"app.worker.js":{"bytes":1089,"sha256":"D3dJYwKDGz3i7Q5U8BMGK01jVcMbOlbpIzeIn9vga88"}},"id":"dev.example.calculator","limits":{"maxEventRate":30,"maxViewNodes":2000},"name":"Pocket Calculator","publisher":{"displayName":"TEST ONLY Example Studio","keyId":"sha256:_oEsEvOrTOasXbaaw1L5BssbEe9D-zPiUu9_9VImOIk","publicKey":"6kpsY-KcUgq-9VB7Ey7F-ZVHdq6-vnuSQh7qaRRG0iw"},"runtime":"smallframe-view/1","schemaVersion":"1.0","state":{"jsonSchema":{"additionalProperties":false,"properties":{"total":{"maximum":1000000000,"minimum":-1000000000,"type":"number"}},"required":["total"],"type":"object"},"maxPlaintextBytes":393216,"mode":"personal","publicTemplate":{"total":0}},"version":"0.1.0"}
