{"capabilities":[],"description":"A deterministic local-first decision board example.","files":{"app.worker.js":{"bytes":824,"sha256":"PDzD1cQ0ffJs72GXms9dtwwt4u_XrSu9vbZsB22H908"}},"id":"dev.example.decision-board","limits":{"maxEventRate":30,"maxViewNodes":2000},"name":"Decision Board","publisher":{"displayName":"TEST ONLY Example Studio","keyId":"sha256:_oEsEvOrTOasXbaaw1L5BssbEe9D-zPiUu9_9VImOIk","publicKey":"6kpsY-KcUgq-9VB7Ey7F-ZVHdq6-vnuSQh7qaRRG0iw"},"runtime":"smallframe-view/1","schemaVersion":"1.0","state":{"jsonSchema":{"additionalProperties":false,"properties":{"decisions":{"additionalProperties":{"additionalProperties":false,"properties":{"title":{"maxLength":120,"type":"string"}},"required":["title"],"type":"object"},"type":"object"}},"required":["decisions"],"type":"object"},"maxPlaintextBytes":393216,"mode":"shared","publicTemplate":{"decisions":{}}},"version":"0.1.0"}
